ID_MDC;ID_Partition;ID_DRG;ID_Text
-1 ;O;901A;Ausgedehnte OR-Prozedur ohne Bezug zur Hauptdiagnose mit bestimmter komplizierender Konstellation oder Strahlentherapie oder endovaskulärer Implantation von Stent-Prothesen an der Aorta
-1 ;O;901B;Ausgedehnte OR-Prozedur ohne Bezug zur Hauptdiagnose ohne Strahlentherapie, ohne endovaskuläre Implantation von Stent-Prothesen an der Aorta, mit hochkomplexer OR-Prozedur oder komplizierender Konstellation
-1 ;O;901C;Ausgedehnte OR-Prozedur ohne Bezug zur Hauptdiagnose ohne komplizierende Konstellation, ohne Strahlentherapie, ohne hochkomplexe OR-Prozedur, mit komplexer OR-Prozedur oder mit anderen Eingriffen an Kopf und Wirbelsäule, Alter < 1 Jahr oder bei Para- / Tetraplegie
-1 ;O;901D;Ausgedehnte OR-Prozedur ohne Bezug zur Hauptdiagnose ohne komplizierende Konstellation, ohne Strahlentherapie, ohne komplexe OR-Prozedur, ohne andere Eingriffe an Kopf und Wirbelsäule, Alter > 0 Jahre, außer bei Para- / Tetraplegie
-1 ;O;902Z;Nicht ausgedehnte OR-Prozedur ohne Bezug zur Hauptdiagnose
-1 ;M;960Z;Nicht gruppierbar
-1 ;M;961Z;Unzulässige Hauptdiagnose
-1 ;M;962Z;Unzulässige Kodierung einer Sectio caesarea
-1 ;M;963Z;Neonatale Diagnose unvereinbar mit Alter oder Gewicht
00 ;O;A01A;Lebertransplantation mit Beatmung > 179 Stunden oder kombinierter Dünndarmtransplantation
00 ;O;A01B;Lebertransplantation ohne kombinierte Dünndarmtransplantation mit Beatmung > 59 und < 180 Stunden oder mit Transplantatabstoßung oder mit kombinierter Nierentransplantation oder Alter < 6 Jahre
00 ;O;A01C;Lebertransplantation ohne kombinierte Dünndarmtransplantation, ohne Beatmung > 59 Stunden, ohne Transplantatabstoßung, ohne kombinierte Nierentransplantation, Alter > 5 Jahre
00 ;O;A02Z;Transplantation von Niere und Pankreas
00 ;O;A03A;Lungentransplantation mit Beatmung > 179 Stunden
00 ;O;A03B;Lungentransplantation ohne Beatmung > 179 Stunden
00 ;O;A04A;Knochenmarktransplantation / Stammzelltransfusion, allogen, mit zweiter Knochenmarktransplantation / Stammzelltransfusion im selben Aufenthalt
00 ;O;A04B;Knochenmarktransplantation / Stammzelltransfusion, allogen, außer bei Plasmozytom oder mit Graft-versus-host-Krankheit Grad III und IV, mit In-vitro-Aufbereitung oder Alter < 16 Jahre
00 ;O;A04C;Knochenmarktransplantation / Stammzelltransfusion, allogen, außer bei Plasmozytom, HLA-verschieden oder bei Plasmozytom, mit Graft-versus-host-Krankheit Grad III und IV, ohne In-vitro-Aufbereitung, Alter > 15 Jahre
00 ;O;A04D;Knochenmarktransplantation / Stammzelltransfusion, allogen, außer bei Plasmozytom, ohne In-vitro-Aufbereitung, Alter > 15 Jahre, ohne Graft-versus-host-Krankheit Grad III und IV, HLA-identisch
00 ;O;A04E;Knochenmarktransplantation / Stammzelltransfusion, allogen, bei Plasmozytom, ohne Graft-versus-host-Krankheit Grad III und IV, Alter > 15 Jahre
00 ;O;A05A;Herztransplantation mit Beatmung > 179 Stunden oder Alter < 16 Jahre
00 ;O;A05B;Herztransplantation ohne Beatmung > 179 Stunden, Alter > 15 Jahre
00 ;O;A06A;Beatmung > 1799 Stunden mit komplexer OR-Prozedur oder Polytrauma, mit hochkomplexem Eingriff oder intensivmedizinischer Komplexbehandlung > 3920 / 3680 Aufwandspunkte
00 ;O;A06B;Beatmung > 1799 Stunden mit komplexer OR-Prozedur oder Polytrauma, ohne hochkomplexen Eingriff, ohne intensivmedizinische Komplexbehandlung > 3920 / 3680 Aufwandspunkte oder ohne komplexe OR-Prozedur, ohne Polytrauma
00 ;O;A07A;Beatmung > 999 Stunden oder > 499 Stunden mit intensivmedizinischer Komplexbehandlung > 4900 / 4600 Aufwandspunkte, mit komplexer OR-Prozedur oder Polytrauma und int. Komplexbehandlung > 3920 / 3680 P. oder mit hochkomplexem oder dreizeitigem Eingriff
00 ;O;A07B;Beatmung > 999 Stunden oder > 499 Stunden mit intensivmedizinischer Komplexbehandlung > 4900 / 4600 Aufwandspunkte, mit komplexer OR-Prozedur und komplizierender Konstellation oder mit Polytrauma oder Alter < 16 Jahre
00 ;O;A07C;Beatmung > 999 Stunden oder > 499 Stunden mit intensivmedizinischer Komplexbehandlung > 4900 / 4600 Aufwandspunkte, ohne komplexe OR-Prozedur, ohne Polytrauma, Alter > 15 Jahre, mit intensivmedizinischer Komplexbehandlung > 2352 / 2208 Aufwandspunkte
00 ;O;A07D;Beatmung > 999 Stunden ohne komplexe OR-Prozedur, ohne Polytrauma, Alter > 15 Jahre, ohne intensivmedizinische Komplexbehandlung > 2352 / 2208 Aufwandspunkte, mit komplexer Diagnose
00 ;O;A07E;Beatmung > 999 Stunden ohne komplexe OR-Prozedur, ohne Polytrauma, Alter > 15 Jahre, ohne intensivmedizinische Komplexbehandlung > 2352 / 2208 Aufwandspunkte, ohne komplexe Diagnose
00 ;O;A09A;Beatmung > 499 Stunden oder > 249 Stunden mit int. Komplexbeh. > 2352 / 2208 P., mit angeb. Fehlbild. od. Tumorerkr., Alter < 3 J. od. mit kompl. OR-Proz. oder Polytrauma od. int. Komplexbeh. > 3430 / 3220 P. und hochkompl. Eingr. od. Alter < 16 J.
00 ;O;A09B;Beatmung > 499 Stunden oder > 249 Stunden mit intensivmed. Komplexbehandlung > 2352 / 2208 Aufwandsp., mit kompl. OR-Prozedur od. Polytrauma od. intensivmed. Komplexbehandlung > 3430 / 3220 Aufwandsp., mit sehr kompl. Eingriff od. kompliz. Konstellation
00 ;O;A09C;Beatmung > 499 Stunden oder > 249 Stunden mit intensivmedizinischer Komplexbehandlung > 2352 / 2208 Aufwandspunkte, mit komplexer OR-Prozedur oder Polytrauma oder int. Komplexbeh. > 2352 / 2208 P. oder kompliz. Konstellation oder Alter < 16 Jahre
00 ;O;A09D;Beatmung > 499 Stunden, ohne komplexe OR-Prozedur, ohne Polytrauma, Alter > 15 Jahre, ohne komplizierende Konstellation, mit intensivmedizinischer Komplexbehandlung > 1470 / 1380 und < 2353 / 2209 Aufwandspunkte
00 ;O;A09E;Beatmung > 499 Stunden, ohne komplexe OR-Prozedur, ohne Polytrauma, Alter > 15 Jahre, ohne komplizierende Konstellation, ohne intensivmedizinische Komplexbehandlung > 1470 / 1380 Aufwandspunkte, mit komplexer Diagnose oder Prozedur
00 ;O;A09F;Beatmung > 499 Stunden, ohne komplexe OR-Prozedur, ohne Polytrauma, Alter > 15 Jahre, ohne komplizierende Konstellation, ohne intensivmedizinische Komplexbehandlung > 1470 / 1380 Aufwandspunkte, ohne komplexe Diagnose, ohne komplexe Prozedur
00 ;O;A11A;Beatmung > 249 Stunden oder > 95 Stunden mit intensivmedizinischer Komplexbehandlung > 1764 / 1656 Aufwandspunkte, mit hochkompl. Eingriff oder Alter < 2 J. bei angeborener Fehlbildung od. mit kompliz. Konstellation und best. OR-Prozedur, Alter < 16 J.
00 ;O;A11B;Beatmung > 249 Stunden oder > 95 Stunden mit intensivmedizinischer Komplexbehandlung > 1764 / 1656 Aufwandspunkte, mit komplexer OR-Prozedur und Alter < 16 Jahre oder kompliz. Konstellation, oder bei Tumor oder angeborener Fehlbildung, Alter < 3 Jahre
00 ;O;A11C;Beatmung > 249 Stunden, ohne komplexe OR-Prozedur, ohne intensivmedizinische Komplexbehandlung > 1764 / 1656 Aufwandspunkte, mit komplizierender Konstellation und bestimmter OR-Prozedur, Alter > 15 Jahre
00 ;O;A11D;Beatmung > 249 Stunden, mit komplexer OR-Prozedur, ohne hochkomplexen Eingriff, ohne intensivmedizinische Komplexbehandlung > 1764 / 1656 Aufwandspunkte, ohne komplizierende Konstellation, Alter > 15 Jahre
00 ;O;A11E;Beatmung > 249 Stunden oder > 95 Stunden mit intensivmedizinischer Komplexbehandlung > 1764 / 1656 Aufwandspunkte, mit bestimmter OR-Prozedur oder kompliz. Konstellation oder int. Komplexbeh. > 1176 / 1104 P. oder Alter < 6 Jahre
00 ;O;A11F;Beatmung > 249 Stunden, ohne komplexe oder bestimmte OR-Prozedur, ohne intensivmedizinische Komplexbehandlung > 1176 / 1104 Aufwandspunkte, ohne komplizierende Konstellation, Alter > 5 Jahre, mit komplexer Diagnose oder Prozedur oder Alter < 16 Jahre
00 ;O;A11G;Beatmung > 249 Stunden, ohne komplexe oder bestimmte OR-Prozedur, ohne intensivmedizinische Komplexbehandlung > 1176 / 1104 Aufwandspunkte, ohne komplizierende Konstellation, Alter > 15 Jahre, ohne komplexe Diagnose oder Prozedur, mit äußerst schweren CC
00 ;O;A11H;Beatmung > 249 Stunden, ohne komplexe oder bestimmte OR-Prozedur, ohne intensivmedizinische Komplexbehandlung > 1176 / 1104 Aufwandspunkte, ohne komplizierende Konstellation, Alter > 15 Jahre, ohne komplexe Diagnose oder Prozedur, ohne äußerst schwere CC
00 ;O;A13A;Beatmung > 95 Stunden mit hochkomplexem Eingriff od. mit komplexer OR-Prozedur u. intensivmed. Komplexbeh.> 1176 / 1104 P. od. mit kompliz. Konst. u. best. OR-Proz. und Alter < 16 J. od. intensivmed. Komplexbeh. > 1176 / 1104 P. bei Lymphom und Leukämie
00 ;O;A13B;Beatmung > 95 Stunden mit komplexer OR-Prozedur und sehr komplexem Eingriff oder Eingriff bei angeborener Fehlbildung, Alter < 10 Jahre, oder mit intensivmed. Komplexbehandlung > 1176 / 1104 Punkte und komplizierender Konstellation
00 ;O;A13C;Beatmung > 95 Stunden ohne komplexe OR-Prozedur, mit bestimmter OR-Prozedur und kompliz. Konstellation, Alter > 15 J. oder mit intensivmed. Komplexbehandlung > 1176 / 1104 Punkte od. Alter < 16 J., ohne Lymphom und Leukämie, ohne kompliz. Konstellation
00 ;O;A13D;Beatmung > 95 Stunden mit komplexer OR-Prozedur, ohne hochkomplexen oder sehr komplexen Eingriff, ohne intensivmedizinische Komplexbehandlung > 1176 / 1104 Aufwandspunkte, ohne komplizierende Konstellation, ohne Eingriff bei angeborener Fehlbildung
00 ;O;A13E;Beatmung > 95 Stunden, ohne komplexe OR-Prozedur, mit bestimmter OR-Prozedur oder komplizierender Konstellation oder mit intensivmedizinischer Komplexbehandlung > 588 / 552 Aufwandspunkte und < 1177 / 1105 Aufwandspunkte oder Alter < 16 Jahre
00 ;O;A13F;Beatmung > 95 Stunden, ohne komplexe OR-Prozedur, verstorben oder verlegt < 9 Tage oder ohne bestimmte OR-Proz., ohne kompliz. Konstellation, ohne int. Komplexbehandlung > 588 / 552 Aufwandspunkte, Alter > 15 Jahre, mit komplexer Diagnose oder Prozedur
00 ;O;A13G;Beatmung > 95 Stunden, ohne komplexe OR-Prozedur, verstorben oder verlegt < 9 Tage oder ohne bestimmte OR-Proz., ohne kompliz. Konst., ohne int. Komplexbeh. > 588 / 552 P., Alter > 15 Jahre, ohne komplexe Diagnose oder Prozedur, mit äußerst schweren CC
00 ;O;A13H;Beatmung > 95 Stunden, ohne komplexe OR-Prozedur, ohne bestimmte OR-Prozedur, ohne kompliz. Konstellation, ohne int. Komplexbeh. > 588 / 552 P., Alter > 15 Jahre, ohne komplexe Diagnose oder Prozedur, ohne äußerst schwere CC
00 ;O;A15A;Knochenmarktransplantation / Stammzelltransfusion, autogen, mit zweiter Knochenmarktransplantation / Stammzelltransfusion im selben Aufenthalt
00 ;O;A15B;Knochenmarktransplantation / Stammzelltransfusion, autogen, außer bei Plasmozytom, Alter < 16 Jahre
00 ;O;A15C;Knochenmarktransplantation / Stammzelltransfusion, autogen, außer bei Plasmozytom, Alter > 15 Jahre
00 ;O;A15D;Knochenmarktransplantation / Stammzelltransfusion, autogen, bei Plasmozytom
00 ;O;A16A;Transplantation von Darm oder Pankreas
00 ;O;A16B;Injektion von Pankreasgewebe
00 ;O;A17A;Nierentransplantation mit postoperativem Versagen des Nierentransplantates oder Alter < 16 Jahre oder AB0-inkompatible Transplantation
00 ;O;A17B;Nierentransplantation ohne postoperatives Versagen des Nierentransplantates, Alter > 15 Jahre oder ohne AB0-inkompatible Transplantation
00 ;O;A18Z;Beatmung > 999 Stunden und Transplantation von Leber, Lunge, Herz und Knochenmark oder Stammzelltransfusion
00 ;O;A22Z;Korrektureingriff bei Doppelfehlbildung
00 ;O;A36A;Intensivmedizinische Komplexbehandlung > 1764 / 1656 Aufwandspunkte bei bestimmten Krankheiten und Störungen oder intensivmedizinische Komplexbehandlung > 588 / 552 Aufwandspunkte bei Versagen und Abstoßung eines Transplantates hämatopoetischer Zellen
00 ;O;A36B;Intensivmedizinische Komplexbehandlung > 588 / 552 und < 1765 / 1657 Aufwandspunkte bei bestimmten Krankheiten und Störungen oder komplizierende Konstellation bei Versagen und Abstoßung eines Transplantates hämatopoetischer Zellen
00 ;A;A42A;Stammzellentnahme bei Eigenspender mit Chemotherapie
00 ;A;A42B;Stammzellentnahme bei Eigenspender ohne Chemotherapie, Alter < 16 Jahre
00 ;A;A42C;Stammzellentnahme bei Eigenspender ohne Chemotherapie, Alter > 15 Jahre
00 ;A;A43Z;Frührehabilitation bei Wachkoma und Locked-in-Syndrom
00 ;M;A60A;Versagen und Abstoßung eines Organtransplantates, mehr als ein Belegungstag, mit Entfernung eines Organtransplantates oder komplexer OR-Prozedur oder äußerst schweren CC
00 ;M;A60B;Versagen und Abstoßung eines Organtransplantates, mehr als ein Belegungstag, ohne Entfernung eines Organtransplantates, ohne komplexe OR-Prozedur, ohne äußerst schwere CC, Alter < 16 Jahre
00 ;M;A60C;Versagen und Abstoßung eines Organtransplantates, mehr als ein Belegungstag, ohne Entfernung eines Organtransplantates, ohne komplexe OR-Prozedur, ohne äußerst schwere CC, Alter > 15 Jahre
00 ;M;A60D;Versagen und Abstoßung eines Organtransplantates, ein Belegungstag
00 ;M;A61A;Versagen und Abstoßung eines Transplantates hämatopoetischer Zellen, mit äußerst schweren CC
00 ;M;A61B;Versagen und Abstoßung eines Transplantates hämatopoetischer Zellen, ohne äußerst schwere CC
00 ;M;A62Z;Evaluierungsaufenthalt vor Herztransplantation
00 ;M;A63Z;Evaluierungsaufenthalt vor Lungen- oder Herz-Lungen-Transplantation
00 ;M;A64Z;Evaluierungsaufenthalt vor Leber-, Dünndarm oder Nieren-Pankreas-Transplantation
00 ;M;A66Z;Evaluierungsaufenthalt vor anderer Organtransplantation
00 ;M;A69Z;Evaluierungsaufenthalt vor Organtransplantation ohne Aufnahme auf eine Warteliste
00 ;A;A90A;Teilstationäre geriatrische Komplexbehandlung, umfassende Behandlung
00 ;A;A90B;Teilstationäre geriatrische Komplexbehandlung, Basisbehandlung
01 ;O;B01Z;Mehrzeitige komplexe OR-Prozeduren bei Krankheiten und Störungen des Nervensystems
01 ;O;B02A;Komplexe Kraniotomie oder Wirbelsäulen-Operation mit Strahlentherapie, mehr als 8 Bestrahlungen, bei bestimmter Neubildung des Nervensystems oder Alter < 6 Jahre und äuß. schw. CC, bei best. Neubildung d. Nervensyst. oder mit best. Eingr. am Schädel
01 ;O;B02B;Komplexe Kraniotomie oder Wirbelsäulen-Operation mit Strahlentherapie, mehr als 8 Bestrahlungen oder Alter > 5 Jahre und Alter < 18 Jahre mit gr. intrakran. Eingriff und äuß. schw. CC, bei best. Neubildung d. Nervensyst. oder mit best. Eingr. am Schädel
01 ;O;B02C;Komplexe Kraniotomie oder Wirbelsäulen-Operation, Alter < 6 Jahre oder Alter < 18 Jahre mit großem intrakraniellen Eingriff und äußerst schweren CC oder mit komplizierender Konstellation oder mit verschiedenartiger komplexer Prozedur
01 ;O;B02D;Komplexe Kraniotomie oder Wirbelsäulen-Operation ohne Strahlentherapie, Alter > 5 Jahre oder ohne äußerst schwere CC, ohne bestimmten Eingriff am Schädel, ohne komplizierende Konstellation, ohne verschiedenartige komplexe Prozedur
01 ;O;B03Z;Operative Eingriffe bei nicht akuter Para- / Tetraplegie oder Eingriffe an Wirbelsäule und Rückenmark bei bösart. Neubild. od. mit schw. CC od. mit intraop. Monitoring od. Eingriffe b. zerebraler Lähmung, Muskeldystrophie, Neuropathie mit äuß. schw. CC
01 ;O;B04A;Interventionelle und beidseitige Eingriffe an den extrakraniellen Gefäßen mit äußerst schweren CC
01 ;O;B04B;Eingriffe an den extrakraniellen Gefäßen mit äußerst schweren CC und beidseitige Eingriffe an den extrakraniellen Gefäßen ohne äußerst schwere CC
01 ;O;B04C;Interventionelle Eingriffe an den extrakraniellen Gefäßen ohne äußerst schwere CC
01 ;O;B04D;Eingriffe an den extrakraniellen Gefäßen ohne äußerst schwere CC
01 ;O;B05Z;Dekompression bei Karpaltunnelsyndrom
01 ;O;B07Z;Eingriffe an peripheren Nerven, Hirnnerven und anderen Teilen des Nervensystems mit äußerst schweren CC oder komplizierender Diagnose
01 ;O;B09A;Andere Eingriffe am Schädel mit äußerst schweren CC
01 ;O;B09B;Andere Eingriffe am Schädel ohne äußerst schwere CC
01 ;O;B11Z;Frührehabilitation mit bestimmter OR-Prozedur
01 ;O;B12Z;Implantation eines Herzschrittmachers bei Krankheiten und Störungen des Nervensystems oder perkutan-transluminale Gefäßintervention an Herz und Koronargefäßen
01 ;O;B13Z;Epilepsiechirurgie mit invasivem präoperativen Video-EEG
01 ;O;B15Z;Strahlentherapie bei Krankheiten und Störungen des Nervensystems, mehr als ein Belegungstag, mehr als 10 Bestrahlungen
01 ;O;B16Z;Strahlentherapie bei Krankheiten und Störungen des Nervensystems, mehr als ein Belegungstag, weniger als 11 Bestrahlungen
01 ;O;B17A;Eingriffe an peripheren Nerven, Hirnnerven und anderen Teilen des Nervensystems oder Eingriff bei zerebraler Lähmung, Muskeldystrophie oder Neuropathie, mit komplexer Diagnose
01 ;O;B17B;Eingriffe an peripheren Nerven, Hirnnerven und anderen Teilen des Nervensystems oder Eingriff bei zerebraler Lähmung, Muskeldystrophie oder Neuropathie, ohne komplexe Diagnose, mit komplexem Eingriff
01 ;O;B17C;Eingriffe an periph. Nerven, Hirnnerven und anderen Teilen des Nervensyst. oder Eingr. bei zerebr. Lähmung, Muskeldystrophie oder Neuropathie, ohne komplexe Diagnose, ohne komplexen Eingriff, Alter < 19 Jahre oder mit schweren CC, Alter < 16 Jahre
01 ;O;B17D;Eingriffe an periph. Nerven, Hirnnerven und anderen Teilen des Nervensyst. oder Eingr. bei zerebr. Lähmung, Muskeldystrophie oder Neuropathie, ohne komplexe Diagnose, ohne komplexen Eingriff, Alter < 19 Jahre oder mit schweren CC, Alter > 15 Jahre
01 ;O;B17E;Eingriffe an peripheren Nerven, Hirnnerven und anderen Teilen des Nervensystems oder Eingriff bei zerebr. Lähmung, Muskeldystrophie oder Neuropathie, ohne kompl. Diagn., ohne kompl. Eingr., ohne schw. CC, Alter > 18 Jahre, mit mäßig kompl. Eingr.
01 ;O;B17F;Eingriffe an peripheren Nerven, Hirnnerven und anderen Teilen des Nervensystems oder Eingriff bei zerebr. Lähmung, Muskeldystrophie od. Neuropathie, ohne kompl. Diagnose, ohne mäßig kompl. od. kompl. Eingr., ohne äuß. schw. oder schw. CC, Alter > 18 J.
01 ;O;B18Z;Eingriffe an Wirbelsäule und Rückenmark außer bei bösartiger Neubildung, ohne äußerst schwere oder schwere CC oder Revision eines Ventrikelshuntes
01 ;O;B20A;Kraniotomie oder große Wirbelsäulen-Operation mit komplexer Prozedur, Alter < 16 Jahre
01 ;O;B20B;Kraniotomie oder große Wirbelsäulen-Operation mit komplexer Prozedur, Alter > 15 Jahre, mit intraoperativem neurophysiologischen Monitoring oder komplexer Diagnose
01 ;O;B20C;Kraniotomie oder große Wirbelsäulen-Operation ohne komplexe Prozedur, Alter < 3 Jahre oder Alter < 18 Jahre mit großem intrakraniellen Eingriff
01 ;O;B20D;Kraniotomie oder große Wirbelsäulen-Operation mit komplexer Prozedur, Alter > 15 Jahre, ohne intraoperatives neurophysiologisches Monitoring, ohne komplexe Diagnose
01 ;O;B20E;Kraniotomie oder große Wirbelsäulen-Operation ohne komplexe Prozedur, Alter > 2 Jahre, mit komplexer Diagnose oder bestimmtem Eingriff bei Trigeminusneuralgie
01 ;O;B20F;Kraniotomie oder große Wirbelsäulen-Operation ohne komplexe Prozedur, Alter > 2 Jahre, ohne komplexe Diagnose, ohne bestimmten Eingriff bei Trigeminusneuralgie
01 ;O;B21A;Implantation eines Neurostimulators zur Hirnstimulation, Mehrelektrodensystem, mit Sondenimplantation
01 ;O;B21B;Implantation eines Neurostimulators zur Hirnstimulation, Mehrelektrodensystem, ohne Sondenimplantation
01 ;O;B36A;Intensivmedizinische Komplexbehandlung > 1764 / 1656 Aufwandspunkte oder > 1176 / 1104 Aufwandspunkte mit bestimmter OR-Prozedur bei Krankheiten und Störungen des Nervensystems
01 ;O;B36B;Intensivmedizinische Komplexbehandlung > 1176 / 1104 Aufwandspunkte und < 1765 / 1657 Aufwandspunkte ohne best. OR-Prozedur oder > 588 / 552 Aufwandspunkte und < 1177 / 1105 Aufwandspunkte mit best. OR-Proz. bei Krankheiten und Störungen d. Nervensystems
01 ;O;B39A;Neurologische Komplexbehandlung des akuten Schlaganfalls mit bestimmter OR-Prozedur, mehr als 72 Stunden mit komplexem Eingriff oder mit komplizierender Konstellation
01 ;O;B39B;Neurologische Komplexbehandlung des akuten Schlaganfalls mit bestimmter OR-Prozedur, bis 72 Stunden mit komplexem Eingriff, oder mehr als 72 Stunden, ohne komplexen Eingriff, ohne komplizierende Konstellation
01 ;O;B39C;Neurologische Komplexbehandlung des akuten Schlaganfalls mit bestimmter OR-Prozedur, bis 72 Stunden, ohne komplexen Eingriff, ohne komplizierende Konstellation
01 ;A;B42A;Frührehabilitation bei Krankheiten und Störungen des Nervensystems bis 27 Tage mit neurologischer Komplexbehandlung des akuten Schlaganfalls oder fachübergreifende u. andere Frührehabilitation mit neurologischer Komplexbehandlung des akuten Schlaganfalls
01 ;A;B42B;Frührehabilitation bei Krankheiten und Störungen des Nervensystems bis 27 Tage ohne neurologische Komplexbehandlung des akuten Schlaganfalls
01 ;A;B43Z;Frührehabilitation bei Krankheiten und Störungen des Nervensystems, mehr als 27 Tage
01 ;A;B44A;Geriatrische frührehabilitative Komplexbehandlung bei Krankheiten und Störungen des Nervensystems mit schwerer motorischer Funktionseinschränkung, mit neurologischer Komplexbehandlung des akuten Schlaganfalls
01 ;A;B44B;Geriatrische frührehabilitative Komplexbehandlung bei Krankheiten und Störungen des Nervensystems mit schwerer motorischer Funktionseinschränkung, ohne neurologische Komplexbehandlung des akuten Schlaganfalls
01 ;A;B44C;Geriatrische frührehabilitative Komplexbehandlung bei Krankheiten und Störungen des Nervensystems ohne schwere motorische Funktionseinschränkung, mit neurologischer Komplexbehandlung des akuten Schlaganfalls
01 ;A;B44D;Geriatrische frührehabilitative Komplexbehandlung bei Krankheiten und Störungen des Nervensystems ohne schwere motorische Funktionseinschränkung, ohne neurologische Komplexbehandlung des akuten Schlaganfalls
01 ;A;B46Z;Sozial- und neuropädiatrische und pädiatrisch-psychosomatische Therapie bei Krankheiten und Störungen des Nervensystems
01 ;A;B47Z;Multimodale Schmerztherapie bei Krankheiten und Störungen des Nervensystems
01 ;A;B48Z;Frührehabilitation bei Multipler Sklerose und zerebellarer Ataxie, nicht akuter Para- / Tetraplegie oder anderen neurologischen Erkrankungen
01 ;A;B49Z;Multimodale Komplexbehandlung bei Morbus Parkinson
01 ;M;B60A;Nicht akute Paraplegie / Tetraplegie, mehr als ein Belegungstag
01 ;M;B60B;Nicht akute Paraplegie / Tetraplegie, ein Belegungstag
01 ;M;B61A;Bestimmte akute Erkrankungen und Verletzungen des Rückenmarks mit komplexem Eingriff, weniger als 14 Belegungstage, wegverlegt
01 ;M;B61B;Bestimmte akute Erkrankungen und Verletzungen des Rückenmarks ohne komplexen Eingriff oder mehr als 13 Belegungstage oder nicht wegverlegt
01 ;M;B63Z;Demenz und andere chronische Störungen der Hirnfunktion
01 ;M;B64Z;Delirium
01 ;M;B66A;Neubildungen des Nervensystems mit äußerst schweren CC, mehr als ein Belegungstag, Alter < 10 Jahre oder mit komplizierender Konstellation
01 ;M;B66B;Neubildungen des Nervensystems mit äußerst schweren CC, mehr als ein Belegungstag, Alter > 9 Jahre, ohne komplizierende Konstellation
01 ;M;B66C;Neubildungen des Nervensystems, ein Belegungstag oder ohne äußerst schwere CC, Alter < 1 Jahr
01 ;M;B66D;Neubildungen des Nervensystems, ein Belegungstag oder ohne äußerst schwere CC, Alter > 0 Jahre
01 ;M;B67A;Morbus Parkinson mit äußerst schweren CC oder schwerster Beeinträchtigung
01 ;M;B67B;Morbus Parkinson ohne äußerst schwere CC, ohne schwerste Beeinträchtigung
01 ;M;B68A;Multiple Sklerose und zerebellare Ataxie mit äußerst schweren CC, mehr als ein Belegungstag
01 ;M;B68B;Multiple Sklerose und zerebellare Ataxie, ein Belegungstag oder ohne äußerst schwere CC, Alter < 16 Jahre
01 ;M;B68C;Multiple Sklerose und zerebellare Ataxie, ein Belegungstag oder ohne äußerst schwere CC, Alter > 15 Jahre, mit komplexer Diagnose
01 ;M;B68D;Multiple Sklerose und zerebellare Ataxie, ein Belegungstag oder ohne äußerst schwere CC, Alter > 15 Jahre, ohne komplexe Diagnose
01 ;M;B69A;Transitorische ischämische Attacke (TIA) und extrakranielle Gefäßverschlüsse mit neurologischer Komplexbehandlung des akuten Schlaganfalls, mehr als 72 Stunden
01 ;M;B69B;Transitorische ischämische Attacke (TIA) und extrakranielle Gefäßverschlüsse mit neurologischer Komplexbehandlung des akuten Schlaganfalls, bis 72 Stunden, mit äußerst schweren CC
01 ;M;B69C;Transitorische ischämische Attacke (TIA) und extrakranielle Gefäßverschlüsse mit neurol. Komplexbehandlung des akuten Schlaganfalls, bis 72 Std., ohne äuß. schw. CC oder mit anderer neurol. Komplexbeh. des akuten Schlaganfalls oder mit äuß. schw. CC
01 ;M;B69D;Transitorische ischämische Attacke (TIA) und extrakranielle Gefäßverschlüsse ohne neurologische Komplexbehandlung des akuten Schlaganfalls, ohne andere neurologische Komplexbehandlung des akuten Schlaganfalls, ohne äußerst schwere CC
01 ;M;B70A;Apoplexie mit neurologischer Komplexbehandlung des akuten Schlaganfalls, mehr als 72 Stunden, mit komplizierender Diagnose
01 ;M;B70B;Apoplexie mit neurologischer Komplexbehandlung des akuten Schlaganfalls, mehr als 72 Stunden, ohne komplizierende Diagnose oder mit komplexem zerebrovaskulären Vasospasmus
01 ;M;B70C;Apoplexie ohne komplexen zerebrovask. Vasospasmus, mit neurol. Komplexbeh. des akuten Schlaganfalls bis 72 Std., mit komplizierender Diagnose oder systemischer Thrombolyse oder mit anderer neurol. Komplexbeh. des akuten Schlaganfalls, mehr als 72 Std.
01 ;M;B70D;Apoplexie ohne komplexen zerebrovask. Vasospasmus, ohne komplizierende Diagnose oder systemische Thrombolyse, mit neurol. Komplexbeh. des akuten Schlaganfalls bis 72 Std. oder mit anderer neurol. Komplexbeh. des akuten Schlaganfalls bis 72 Std.
