ID_MDC;ID_Partition;ID_DRG;ID_Text
08 ;O;I27C;Eingr. am Weichteilg. oder kleinfl. Gewebetransplant., oh. best. Diagnose und best. Eingriff, oh. Äußerst schw. CC oder bösartige Neub. und schw. CC, mit schw. CC u. mit bösartige Neub. bei best. Eingr. am Weichteilgew. od. kleinfl. Gewebetransplant.
08 ;O;I27D;Eingr. am Weichteilg. oder kleinfl. Gewebetransplant., oh. best. Diagnose und best. Eingriff, oh. Äußerst schw. CC oder bösartige Neub. und schw. CC, oh. schw. CC und oh. bösartige Neub. bei best. Eingr. am Weichteilgew. od. kleinfl. Gewebetransplant.
08 ;O;I28A;Komplexe Eingriffe am Bindegewebe
08 ;O;I28B;Mäßig komplexe Eingriffe am Bindegewebe
08 ;O;I28C;Andere Eingriffe am Bindegewebe
08 ;O;I29A;Komplexe Eingriffe am Schultergelenk oder bestimmte Osteosynthesen an der Klavikula, bei komplizierender Diagnose oder Eingriff an mehreren Lokalisationen
08 ;O;I29B;Komplexe Eingriffe am Schultergelenk oder bestimmte Osteosynthesen an der Klavikula, ohne komplizierende Diagnose oder ohne Eingriff an mehreren Lokalisationen
08 ;O;I30Z;Komplexe Eingriffe am Kniegelenk oder arthroskopische Eingriffe am Hüftgelenk
08 ;O;I31A;Mehrere komplexe Eingriffe an Ellenbogengelenk und Unterarm oder gelenkübergreifende Weichteildistraktion bei angeborenen Anomalien der Hand, mit aufwändigen Eingriffen am Unterarm
08 ;O;I31B;Mehrere komplexe Eingriffe an Ellenbogengelenk und Unterarm oder gelenkübergreifende Weichteildistraktion bei angeborenen Anomalien der Hand
08 ;O;I32A;Eingr. an Handgelenk u. Hand mit mehrzeitigem kompl. od. mäßig kompl. Eingr. od. mit Komplexbehandl. Hand od. mit aufwändigem rekonstruktiven Eingr. bei angeborener Fehlbildung der Hand oder mit best. gefäßgestielten Knochentx. bei Pseudarthrose der Hand
08 ;O;I32B;Eingr. an Handgel. und Hand ohne mehrz. Eingr., oh. Komplexb. Hand, ohne aufw. rekonstr. Eingr., mit kompl. Eingr. od. b. angeb. Anomalie d. Hand od. Pseudarthr., Alter < 6 J. od. kompl. Eingr. b. angeb. Fehlb. d. Hand u. Alter < 16 J.
08 ;O;I32C;Eingr. an Handg. und Hand oh. mehrz. Eingr., oh. Komplexb. Hand, mit kompl. Eingr. od. bei angeb. Anomalie d. Hand od. Pseudarthr., Alter > 5 J. od. oh. kompl. Eingr. b. angeb. Fehlb. d. Hand und Alter < 16 J., mit best. Eingr. od. kompl. Diag.
08 ;O;I32D;Eingriffe an Handgelenk und Hand mit komplexem Eingriff, ohne komplexe Diagnose oder ohne sehr komplexen Eingriff, oder mit komplexer Diagnose oder mit bestimmtem oder beidseitigem Eingriff
08 ;O;I32E;Mäßig komplexe Eingriffe an Handgelenk und Hand, Alter < 6 Jahre
08 ;O;I32F;Mäßig komplexe Eingriffe an Handgelenk und Hand, Alter > 5 Jahre
08 ;O;I32G;Eingriffe an Handgelenk und Hand ohne komplexe oder mäßig komplexe Eingriffe
08 ;O;I33Z;Rekonstruktion von Extremitätenfehlbildungen
08 ;O;I34Z;Geriatrische frührehabilitative Komplexbehandlung mit bestimmter OR-Prozedur bei Krankheiten und Störungen an Muskel-Skelett-System und Bindegewebe
08 ;O;I36Z;Beidseitige Implantation einer Endoprothese an Hüft- und/oder Kniegelenk
08 ;O;I37Z;Resezierender Eingriff am Becken bei bösartiger Neubildung des Beckens oder Mehretageneingriffe an der unteren Extremität
08 ;O;I39Z;Strahlentherapie bei Krankheiten und Störungen an Muskel-Skelett-System und Bindegewebe, mehr als 8 Bestrahlungen
08 ;A;I40Z;Frührehabilitation bei Krankheiten und Störungen an Muskel-Skelett-System und Bindegewebe
08 ;A;I41Z;Geriatrische frührehabilitative Komplexbehandlung bei Krankheiten und Störungen an Muskel-Skelett-System und Bindegewebe
08 ;A;I42Z;Multimodale Schmerztherapie bei Krankheiten und Störungen an Muskel-Skelett-System und Bindegewebe
08 ;O;I43A;Implantation oder Wechsel bestimmter Endoprothesen am Knie- oder am Ellenbogengelenk oder Prothesenwechsel am Schulter- oder am Sprunggelenk, mit äußerst schweren CC
08 ;O;I43B;Implantation oder Wechsel bestimmter Endoprothesen am Knie- oder am Ellenbogengelenk oder Prothesenwechsel am Schulter- oder am Sprunggelenk, ohne äußerst schwere CC
08 ;O;I44A;Implantation einer bikondylären Endoprothese oder andere Endoprothesenimplantation / -revision am Kniegelenk, mit äußerst schweren CC oder Korrektur einer Brustkorbdeformität
08 ;O;I44B;Implantation einer bikondylären Endoprothese oder andere Endoprothesenimplantation / -revision am Kniegelenk, ohne äußerst schweren CC oder ohne Korrektur einer Brustkorbdeformität
08 ;O;I44C;Verschiedene Endoprotheseneingriffe am Kniegelenk
08 ;O;I45A;Implantation und Ersatz einer Bandscheibenendoprothese, mehr als ein Segment
08 ;O;I45B;Implantation und Ersatz einer Bandscheibenendoprothese, weniger als 2 Segmente
08 ;O;I46A;Prothesenwechsel am Hüftgelenk mit äußerst schweren CC oder Eingriff an mehreren Lokalisationen
08 ;O;I46B;Prothesenwechsel am Hüftgelenk ohne äußerst schwere CC, ohne Eingriff an mehreren Lokalisationen
08 ;O;I47A;Revision oder Ersatz des Hüftgelenkes ohne komplizierende Diagnose, ohne Arthrodese, ohne äußerst schwere CC, Alter > 15 Jahre, mit komplizierendem Eingriff oder mit Implantation / Wechsel einer Radiuskopfprothese
08 ;O;I47B;Revision oder Ersatz des Hüftgelenkes ohne komplizierende Diagnose, ohne Arthrodese, ohne äußerst schwere CC, Alter > 15 Jahre, ohne komplizierenden Eingriff
08 ;O;I50Z;Gewebe- / Hauttransplantation, außer an der Hand, ohne komplizierende Konstellation, ohne Eingriff an mehreren Lokalisationen, ohne schweren Weichteilschaden, ohne äußerst schwere oder schwere CC
08 ;O;I54Z;Strahlentherapie bei Krankheiten und Störungen an Muskel-Skelett-System und Bindegewebe, weniger als 9 Bestrahlungen bei bösartiger Neubildung
08 ;O;I59Z;Andere Eingriffe an Humerus, Tibia, Fibula und Sprunggelenk oder mäßig komplexe Eingriffe an Kniegelenk, Ellenbogengelenk und Unterarm
08 ;M;I60Z;Frakturen am Femurschaft, Alter < 3 Jahre
08 ;M;I64A;Osteomyelitis, Alter < 16 Jahre
08 ;M;I64B;Osteomyelitis, Alter > 15 Jahre, mit äußerst schweren oder schweren CC
08 ;M;I64C;Osteomyelitis, Alter > 15 Jahre, ohne äußerst schwere oder schwere CC
08 ;M;I65A;Bösartige Neubildung des Bindegewebes einschließlich pathologischer Fraktur, Alter < 17 Jahre oder mit äußerst schweren CC, mit hochkomplexer Chemotherapie
08 ;M;I65B;Bösartige Neubildung des Bindegewebes einschließlich pathologischer Fraktur, Alter < 17 Jahre oder mit äußerst schweren CC, ohne hochkomplexe Chemotherapie
08 ;M;I65C;Bösartige Neubildung des Bindegewebes einschließlich pathologischer Fraktur, Alter > 16 Jahre, ohne äußerst schwere CC
08 ;M;I66A;Andere Erkrankungen des Bindegewebes, mehr als ein Belegungstag, mit äußerst schweren CC
08 ;M;I66B;Andere Erkrankungen des Bindegewebes, mehr als ein Belegungstag, ohne äußerst schwere CC oder Frakturen an Becken und Schenkelhals
08 ;M;I66C;Andere Erkrankungen des Bindegewebes, ein Belegungstag
08 ;M;I68A;Nicht operativ behandelte Erkrankungen und Verletzungen im Wirbelsäulenbereich, mehr als ein Belegungstag, mit schweren CC oder bei Para- / Tetraplegie, bei Diszitis oder infektiöser Spondylopathie
08 ;M;I68B;Nicht operativ behandelte Erkrankungen und Verletzungen im Wirbelsäulenbereich, mehr als ein Belegungstag, mit schw. CC oder bei Para- / Tetraplegie, Alter > 65 Jahre oder mit kompl. Diagnose außer bei Diszitis oder infektiöser Spondylopathie
08 ;M;I68C;Nicht operativ behandelte Erkrankungen und Verletzungen im WS-Bereich, mehr als ein Belegungstag, mit schw. CC, Alter > 65 Jahre od. äuß. schwere CC, außer bei Para- / Tetraplegie, ohne komplexe Diagnose, außer bei Diszitis od. infektiöser Spondylopathie
08 ;M;I68D;Nicht operativ behandelte Erkrankungen und Verl. im WS-Bereich, mehr als ein Belegungstag, bei and. Femurfraktur, Alt. < 65 J., mit schw. CC, oh. äuß. schw. CC, auß. b. Para- / Tetraplegie, auß. b. Diszitis od. infekt. Spondylopathie, oh. kompl. Diagn.
08 ;M;I68E;Nicht operativ behandelte Erkrankungen und Verletzungen im Wirbelsäulenbereich, ein Belegungstag
08 ;M;I69A;Knochenkrankheiten und spezifische Arthropathien mit komplexer Diagnose oder Muskel- und Sehnenerkrankungen bei Para- / Tetraplegie
08 ;M;I69B;Knochenkrankheiten und spezifische Arthropathien ohne komplexe Diagnose
08 ;M;I71A;Muskel- und Sehnenerkrankungen außer bei Para- / Tetraplegie oder Verstauchung, Zerrung, Luxation an Hüftgelenk, Becken und Oberschenkel, mit Zerebralparese oder Kontraktur
08 ;M;I71B;Muskel- und Sehnenerkrankungen außer bei Para- / Tetraplegie oder Verstauchung, Zerrung, Luxation an Hüftgelenk, Becken und Oberschenkel, ohne Zerebralparese, ohne Kontraktur
08 ;M;I72Z;Entzündung von Sehnen, Muskeln und Schleimbeuteln mit äußerst schweren oder schweren CC oder Frakturen am Femurschaft, Alter > 2 Jahre
08 ;M;I73Z;Nachbehandlung bei Erkrankungen des Bindegewebes
08 ;M;I74A;Verletzungen an Unterarm, Handgelenk, Hand oder Fuß mit äußerst schweren oder schweren CC oder unspezifische Arthropathien
08 ;M;I74B;Verletzungen an Unterarm, Handgelenk, Hand oder Fuß ohne äußerst schwere oder schwere CC, Alter < 10 Jahre
08 ;M;I74C;Verletzungen an Unterarm, Handgelenk, Hand oder Fuß ohne äußerst schwere oder schwere CC, Alter > 9 Jahre
08 ;M;I75A;Schwere Verletzungen von Schulter, Arm, Ellenbogen, Knie, Bein und Sprunggelenk mit CC
08 ;M;I75B;Schwere Verletzungen von Schulter, Arm, Ellenbogen, Knie, Bein und Sprunggelenk ohne CC oder Entzündungen von Sehnen, Muskeln und Schleimbeuteln ohne äußerst schwere oder schwere CC
08 ;M;I76A;Andere Erkrankungen des Bindegewebes mit komplizierender Diagnose oder äußerst schweren CC oder septische Arthritis mit äußerst schweren CC oder Alter < 16 Jahre
08 ;M;I76B;Andere Erkrankungen des Bindegewebes ohne komplizierende Diagnose, ohne äußerst schwere CC oder septische Arthritis ohne äußerst schwere CC, Alter > 15 Jahre
08 ;M;I77Z;Mäßig schwere Verletzungen von Schulter, Arm, Ellenbogen, Knie, Bein und Sprunggelenk
08 ;M;I78Z;Leichte bis moderate Verletzungen von Schulter, Arm, Ellenbogen, Knie, Bein und Sprunggelenk
08 ;M;I79Z;Fibromyalgie
08 ;O;I95Z;Implantation einer Tumorendoprothese oder Knochentotalersatz am Femur
08 ;O;I96Z;Frührehabilitation mit bestimmter OR-Prozedur bei Krankheiten und Störungen an Muskel-Skelett-System und Bindegewebe, mehr als 20 Tage
08 ;A;I97Z;Rheumatologische Komplexbehandlung bei Krankheiten und Störungen an Muskel-Skelett-System und Bindegewebe
08 ;O;I98Z;Komplexe Vakuumbehandlung bei Krankheiten und Störungen an Muskel-Skelett-System und Bindegewebe
09 ;O;J01Z;Gewebetransplantation mit mikrovaskulärer Anastomosierung bei bösartiger Neubildung an Haut, Unterhaut und Mamma
09 ;O;J02A;Hauttransplantation oder Lappenplastik an der unteren Extr. bei Ulkus od. Infektion / Entzündung od. ausgedehnte Lymphad. od. Gewebetranspl. mit mikrovask. Anastomos., mit äuß. schw. CC bei Para- / Tetraplegie od. mit kompl. Eingr.
09 ;O;J02B;Hauttranspl. od. Lappenpl. an d. unt. Extr. b. Ulkus/Infekt./Entz. od. ausged. Lymphad. od. Gewebetranspl. m. mikrovask. Anastomos., m. äuß. schw. CC auß. b. Para- / Tetrapl., oh. kompl. Eingr. od. oh. äuß. schw. CC, m. kompl. Eingr.
09 ;O;J02C;Hauttransplantation oder Lappenplastik an der unteren Extremität bei Ulkus oder Infektion / Entzündung oder ausgedehnte Lymphadenektomie, ohne äußerst schwere CC, ohne komplexen Eingriff
09 ;O;J03Z;Eingriffe an der Haut der unteren Extremität bei Ulkus oder Infektion / Entzündung
09 ;O;J04Z;Eingriffe an der Haut der unteren Extremität außer bei Ulkus oder Infektion / Entzündung
09 ;O;J06Z;Mastektomie mit Prothesenimplantation und plastischer Operation bei bösartiger Neubildung
09 ;O;J07A;Kleine Eingriffe an der Mamma mit axillärer Lymphknotenexzision oder äußerst schweren oder schweren CC bei bösartiger Neubildung, mit beidseitigem Eingriff
09 ;O;J07B;Kleine Eingriffe an der Mamma mit axillärer Lymphknotenexzision oder äußerst schweren oder schweren CC bei bösartiger Neubildung, ohne beidseitigen Eingriff
09 ;O;J08A;Andere Hauttransplantation oder Debridement mit kompl. Diagnose oder mit Eingr. an Kopf u. Hals od. äußerst schw. CC, mit kompl. Proz. od. Eingr. an d. Haut der unt. Extremität b. Ulkus od. Infekt. / Entzünd. b. Para- / Tetrapl., mit äußerst schw. CC
09 ;O;J08B;Andere Hauttransplantation oder Debridement ohne komplexe Prozedur, mit bestimmtem Eingriff an Haut, Unterhaut und Mamma, mit äußerst schweren CC
09 ;O;J08C;Andere Hauttransplantation oder Debridement ohne komplexe Prozedur, mit komplexer Diagnose oder mit Eingriff an Kopf und Hals, ohne bestimmten Eingriff an Haut, Unterhaut und Mamma oder ohne äußerst schwere CC
09 ;O;J09A;Eingriffe bei Sinus pilonidalis und perianal, Alter < 16 Jahre
09 ;O;J09B;Eingriffe bei Sinus pilonidalis und perianal, Alter > 15 Jahre
09 ;O;J10A;Plastische Operationen an Haut, Unterhaut und Mamma bei bösartiger Neubildung
09 ;O;J10B;Plastische Operationen an Haut, Unterhaut und Mamma außer bei bösartiger Neubildung
09 ;O;J11A;Andere Eingriffe an Haut, Unterhaut und Mamma mit bestimmtem Eingriff bei komplizierender Diagnose oder bei Para- / Tetraplegie oder selektive Embolisation bei Hämangiom
09 ;O;J11B;Andere Eingriffe an Haut, Unterhaut und Mamma ohne bestimmten Eingriff bei komplizierender Diagnose, außer bei Para- / Tetraplegie, ohne selektive Embolisation bei Hämangiom, mit mäßig komplexer Prozedur oder komplexer Diagnose
09 ;O;J11C;Andere Eingriffe an Haut, Unterhaut und Mamma ohne komplizierende Diagnose, außer bei Para- / Tetraplegie, ohne selektive Embolisation bei Hämangiom, ohne mäßig komplexe Prozedur, ohne komplexe Diagnose
09 ;O;J14A;Plastische Rekonstruktion der Mamma bei bösart. Neubild. mit aufwändiger Rekonstr. oder beidseit. Mastektomie bei bösart. Neubild. oder Strahlenther. mit operat. Proz. bei Krankh. und Störungen an Haut, Unterhaut und Mamma, mit beidseit. Prothesenimpl.
09 ;O;J14B;Plastische Rekonstruktion der Mamma bei bösartiger Neubildung ohne aufwändige Rekonstruktion
09 ;O;J16Z;Beidseitige Mastektomie bei bösartiger Neubildung oder Strahlentherapie mit operativer Prozedur bei Krankheiten und Störungen an Haut, Unterhaut und Mamma, ohne beidseitige Prothesenimplantation
09 ;O;J17Z;Strahlentherapie bei Krankheiten und Störungen an Haut, Unterhaut und Mamma, mehr als ein Belegungstag, mehr als 9 Bestrahlungen
09 ;O;J18Z;Andere Strahlentherapie bei Krankheiten und Störungen an Haut, Unterhaut und Mamma, mehr als ein Belegungstag
09 ;O;J21Z;Andere Hauttransplantation oder Debridement mit Lymphknotenexzision oder schweren CC
09 ;O;J22A;Andere Hauttransplantation oder Debridement ohne komplexen Eingriff, ohne komplexe Diagnose, ohne äußerst schwere oder schwere CC, mit Weichteildeckung
09 ;O;J22B;Andere Hauttransplantation oder Debridement ohne komplexen Eingriff, ohne komplexe Diagnose, ohne äußerst schwere oder schwere CC, ohne Weichteildeckung
09 ;O;J23Z;Große Eingriffe an der Mamma bei bösartiger Neubildung ohne komplexen Eingriff, ohne bestimmten Eingriff an den weiblichen Geschlechtsorganen bei bösartiger Neubildung
09 ;O;J24A;Eingriffe an der Mamma außer bei bösartiger Neubildung mit ausgedehntem Eingriff, mit Prothesenimplantation oder bestimmter Mammareduktionsplastik
09 ;O;J24B;Eingriffe an der Mamma außer bei bösartiger Neubildung mit ausgedehntem Eingriff, ohne Prothesenimplantation, ohne bestimmte Mammareduktionsplastik
09 ;O;J24C;Eingriffe an der Mamma außer bei bösartiger Neubildung ohne ausgedehnten Eingriff, mit komplexem Eingriff
09 ;O;J24D;Eingriffe an der Mamma außer bei bösartiger Neubildung ohne ausgedehnten Eingriff, ohne komplexen Eingriff
09 ;O;J25Z;Kleine Eingriffe an der Mamma bei bösartiger Neubildung ohne äußerst schwere oder schwere CC
09 ;O;J26Z;Plastische Rekonstruktion der Mamma mit komplexer Hauttransplantation oder große Eingriffe an der Mamma bei bösartiger Neubildung mit komplexem Eingriff oder bestimmtem Eingriff an den weiblichen Geschlechtsorganen bei bösartiger Neubildung
09 ;O;J35Z;Komplexe Vakuumbehandlung bei Krankheiten und Störungen an Haut, Unterhaut und Mamma
09 ;A;J44Z;Geriatrische frührehabilitative Komplexbehandlung bei Krankheiten und Störungen an Haut, Unterhaut und Mamma
09 ;M;J61A;Schwere Erkrankungen der Haut, mehr als ein Belegungstag, Alter > 17 Jahre oder mit komplexer Diagnose, mit äußerst schweren CC oder Hautulkus bei Para- / Tetraplegie oder hochkomplexe Diagnose
09 ;M;J61B;Schwere Erkrankungen der Haut, mehr als ein Belegungstag, Alter > 17 Jahre, ohne äußerst schwere CC, ohne hochkomplexe Diagnose
09 ;M;J61C;Schwere Erkrankungen der Haut, mehr als ein Belegungstag, Alter < 18 Jahre, ohne hochkomplexe Diagnose oder mäßig schwere Hauterkrankungen, mehr als ein Belegungstag
09 ;M;J62A;Bösartige Neubildungen der Mamma, mehr als ein Belegungstag, mit äußerst schweren CC
09 ;M;J62B;Bösartige Neubildungen der Mamma, ein Belegungstag oder ohne äußerst schwere CC
09 ;M;J64A;Infektion / Entzündung der Haut und Unterhaut oder Hautulkus mit äußerst schweren CC
09 ;M;J64B;Infektion / Entzündung der Haut und Unterhaut oder Hautulkus ohne äußerst schwere CC
09 ;M;J65Z;Verletzung der Haut, Unterhaut und Mamma
09 ;M;J67Z;Erkrankungen der Mamma außer bösartige Neubildung oder leichte bis moderate Hauterkrankungen
09 ;M;J68A;Erkrankungen der Haut, ein Belegungstag, mit komplexer Diagnose
09 ;M;J68B;Erkrankungen der Haut, ein Belegungstag, ohne komplexe Diagnose
09 ;M;J77Z;Komplexbehandlung bei multiresistenten Erregern bei Krankheiten und Störungen an Haut, Unterhaut und Mamma
10 ;O;K01Z;Verschiedene Eingriffe bei Diabetes mellitus mit Komplikationen, mit Frührehabilitation oder geriatrischer frührehabilitativer Komplexbehandlung
10 ;O;K03A;Eingriffe an der Nebenniere bei bösartiger Neubildung oder Eingriff an der Hypophyse, Alter < 18 Jahre
10 ;O;K03B;Eingriffe an der Nebenniere bei bösartiger Neubildung oder Eingriff an der Hypophyse, Alter > 17 Jahre
10 ;O;K04A;Große Eingriffe bei Adipositas mit komplexem Eingriff
10 ;O;K04B;Große Eingriffe bei Adipositas ohne komplexen Eingriff
10 ;O;K06A;Eingriffe an Schilddrüse, Nebenschilddrüse und Ductus thyreoglossus bei bösartiger Neubildung mit äußerst schweren CC oder Parathyreoidektomie oder äußerst schwere oder schwere CC, mit Thyreoidektomie durch Sternotomie
10 ;O;K06B;Eingriffe an Schilddrüse, Nebenschilddrüse und Ductus thyreoglossus ohne äußerst schwere CC, bei bösartiger Neubildung
10 ;O;K06C;Eingriffe an Schilddrüse, Nebenschilddrüse und Ductus thyreoglossus, mit Parathyreoidektomie oder äuß. schw. oder schw. CC, ohne Thyreoidektomie durch Sternotomie, außer bei bösartiger Neubildung
10 ;O;K06D;Eingriffe an Schilddrüse, Nebenschilddrüse und Ductus thyreoglossus, außer bei bösartiger Neubildung, ohne Parathyreoidektomie, ohne äußerst schwere oder schwere CC
10 ;O;K07Z;Andere Eingriffe bei Adipositas
10 ;O;K09A;Andere Prozeduren bei endokrinen, Ernährungs- und Stoffwechselkrankheiten mit hochkomplexem Eingriff oder mit bestimmtem Eingriff und Alter < 7 Jahre oder äußerst schwere CC
10 ;O;K09B;Andere Prozeduren bei endokrinen, Ernährungs- und Stoffwechselkrankheiten, ohne hochkomplexen Eingriff, ohne bestimmten Eingriff, mit komplexem Eingriff
10 ;O;K09C;Andere Prozeduren bei endokrinen, Ernährungs- und Stoffwechselkrankheiten, ohne hochkomplexen Eingriff, ohne bestimmten Eingriff, ohne komplexen Eingriff
10 ;O;K14Z;Eingriffe an der Nebenniere außer bei bösartiger Neubildung und ausgedehnte Lymphadenektomie
10 ;O;K15A;Strahlentherapie bei endokrinen, Ernährungs- und Stoffwechselkrankheiten, mehr als ein Belegungstag, außer Radiojodtherapie
10 ;O;K15B;Strahlentherapie bei endokrinen, Ernährungs- und Stoffwechselkrankheiten, mehr als ein Belegungstag, mit hochkomplexer Radiojodtherapie
10 ;O;K15C;Strahlentherapie bei endokrinen, Ernährungs- und Stoffwechselkrankheiten, mehr als ein Belegungstag, mit mäßig komplexer Radiojodtherapie
10 ;O;K15D;Strahlentherapie bei endokrinen, Ernährungs- und Stoffwechselkrankheiten, mehr als ein Belegungstag, mit anderer Radiojodtherapie
10 ;O;K25Z;Komplexbehandlung bei multiresistenten Erregern mit OR-Prozedur bei endokrinen, Ernährungs- und Stoffwechselkrankheiten
10 ;O;K33Z;Mehrzeitige komplexe OR-Prozeduren bei endokrinen, Ernährungs- und Stoffwechselkrankheiten
10 ;O;K38Z;Hämophagozytäre Erkrankungen
10 ;A;K43Z;Frührehabilitation bei endokrinen, Ernährungs- und Stoffwechselkrankheiten
10 ;A;K44Z;Geriatrische frührehabilitative Komplexbehandlung bei endokrinen, Ernährungs- und Stoffwechselkrankheiten
10 ;M;K60A;Diabetes mellitus und schwere Ernährungsstörungen, Alter < 16 Jahre, mit multimodaler Komplexbehandlung bei Diabetes mellitus
10 ;M;K60B;Diabetes mellitus mit äußerst schweren CC oder schwere Ernährungsstörungen, ohne multimodale Komplexbehandlung bei Diabetes mellitus
10 ;M;K60C;Diabetes mellitus ohne äußerst schwere CC, Alter < 11 Jahre oder Alter < 16 Jahre mit schweren CC oder multiplen Komplikationen oder Ketoazidose, ohne multimodale Komplexbehandlung bei Diabetes mellitus
10 ;M;K60D;Diabetes mellitus mit schweren CC oder mit multiplen Komplikationen oder Ketoazidose, Alter > 15 Jahre
10 ;M;K60E;Diabetes mellitus, Alter > 10 Jahre, ohne äußerst schwere oder schwere CC, ohne multiple Komplikationen, ohne Ketoazidose, ohne multimodale Komplexbehandlung bei Diabetes mellitus
10 ;M;K62A;Verschiedene Stoffwechselerkrankungen bei Para- / Tetraplegie oder mit komplizierender Diagnose oder endoskopischer Einlage eines Magenballons oder äußerst schweren CC
10 ;M;K62B;Verschiedene Stoffwechselerkrankungen außer bei Para- / Tetraplegie, ohne komplizierende Diagnose, ohne endoskopische Einlage eines Magenballons, ohne äußerst schwere CC
10 ;M;K63A;Angeborene Stoffwechselstörungen, mehr als ein Belegungstag, Alter < 6 Jahre oder mit komplexer Diagnose
10 ;M;K63B;Angeborene Stoffwechselstörungen, mehr als ein Belegungstag, Alter > 5 Jahre, ohne komplexe Diagnose
10 ;M;K63C;Angeborene Stoffwechselstörungen, ein Belegungstag
10 ;M;K64A;Endokrinopathien, mit komplexer Diagnose und äußerst schweren CC
10 ;M;K64B;Endokrinopathien mit komplexer Diagnose oder äußerst schweren CC, Alter < 6 Jahre
10 ;M;K64C;Endokrinopathien mit komplexer Diagnose oder äußerst schweren CC, Alter > 5 Jahre oder mit bestimmter Diagnose
10 ;M;K64D;Endokrinopathien ohne komplexe Diagnose, ohne bestimmte Diagnose, ohne äußerst schwere CC
10 ;M;K77Z;Komplexbehandlung bei multiresistenten Erregern bei endokrinen, Ernährungs- und Stoffwechselkrankheiten
11 ;O;L02A;Operatives Einbringen eines Peritonealdialysekatheters, Alter < 10 Jahre oder Blasenrekonstruktion und kontinenter Pouch bei Neubildung mit Multiviszeraleingriff oder Verschluss einer Blasenekstrophie
11 ;O;L02B;Operatives Einbringen eines Peritonealdialysekatheters, Alter > 9 Jahre mit akuter Niereninsuffizienz, oder mit chronischer Niereninsuffizienz mit Dialyse
11 ;O;L02C;Operatives Einbringen eines Peritonealdialysekatheters, Alter > 9 Jahre, ohne akute Niereninsuffizienz, ohne chronische Niereninsuffizienz mit Dialyse
11 ;O;L03Z;Nieren-, Ureter- und große Harnblaseneingriffe bei Neubildung, Alter < 19 Jahre oder mit äußerst schweren CC oder Kombinationseingriff, ohne großen Eingriff am Darm
11 ;O;L04A;Nieren-, Ureter- und große Harnblaseneingriffe außer bei Neubildung, ohne äußerst schwere CC, ohne Kombinationseingriff, Alter < 16 Jahre
11 ;O;L04B;Nieren-, Ureter- und große Harnblaseneingriffe außer bei Neubildung, ohne äußerst schwere CC, ohne Kombinationseingriff, Alter > 15 Jahre
11 ;O;L05A;Transurethrale Prostataresektion mit äußerst schweren CC
11 ;O;L05B;Transurethrale Prostataresektion ohne äußerst schwere CC
11 ;O;L06A;Kleine Eingriffe an der Harnblase mit äußerst schweren CC
11 ;O;L06B;Kleine Eingriffe an der Harnblase ohne äußerst schwere CC
11 ;O;L08A;Komplexe Eingriffe an der Urethra, Alter < 6 Jahre
11 ;O;L08B;Komplexe Eingriffe an der Urethra, Alter > 5 Jahre
11 ;O;L09A;Andere Eingriffe bei Erkr. der Harnorgane mit Anlage eines Dialyseshunts bei akuter Niereninsuff. od. bei chron. Niereninsuff. mit Dialyse od. auß. Anl. e. Dialyseshunts, m. Kalziphylaxie, kompl. OR-Proz. od. kompl. Eingr., Alter < 2 J. od. äuß. schw. CC
11 ;O;L09B;Andere Eingriffe bei Erkrankungen der Harnorgane mit Anlage eines Dialyseshunts bei akuter Niereninsuffizienz od. bei chronischer Niereninsuff. mit Dialyse oder außer Anlage e. Dialyseshunts, m. Kalziphylaxie, Alter > 1 Jahr, ohne äußerst schwere CC
11 ;O;L09C;Andere Eingriffe bei Erkrankungen der Harnorgane außer Anlage eines Dialyseshunts, ohne Kalziphylaxie, Alter < 2 Jahre oder äußerst schw. CC, ohne kompl. OR-Prozedur, ohne kompl. Eingriff, Alter > 1 Jahr, ohne äuß. schw. CC, mit Schilddrüsenresektion
11 ;O;L09D;Andere Eingriffe bei Erkrankungen der Harnorgane ohne Anlage eines Dialyseshunts bei akuter Niereninsuffizienz od. bei chronischer Niereninsuff. mit Dialyse, ohne Kalziphylaxie, ohne Schilddrüsenresektion
11 ;O;L10Z;Blasenrekonstruktion und kontinenter Pouch bei Neubildung ohne Multiviszeraleingriff oder Nieren-, Ureter- und große Harnblaseneingriffe bei Neubildung, Alter < 19 Jahre oder mit äußerst schweren CC oder Kombinationseingriff, mit großem Eingriff am Darm
11 ;O;L11Z;Komplexe transurethrale, perkutan-transrenale und andere retroperitoneale Eingriffe mit extrakorporaler Stoßwellenlithotripsie (ESWL), ohne äußerst schwere CC
11 ;O;L12Z;Strahlentherapie bei Krankheiten und Störungen der Harnorgane, mehr als ein Belegungstag
11 ;O;L13A;Nieren-, Ureter- und große Harnblaseneingriffe bei Neubildung, Alter > 18 Jahre, ohne Kombinationseingriff, mit CC
